{
  "version": "0.1",
  "id": "baskets-ratio-43",
  "audience": {
    "grade": 6,
    "language": "zh-CN",
    "priorKnowledge": [
      "比与比例：理解 a:b = c:d 的含义",
      "百分数化为小数或分数（20% = 0.2）",
      "用字母表示未知数（一元一次方程）",
      "等式的传递性与交叉相乘"
    ],
    "assumption": "六年级上册比与比例单元。题目中「取出 20%」是百分比减少问题；比例 4:3 出现在「取出之后」，不是「取出之前」，这是核心易错点。"
  },
  "question": "有两筐水果，甲筐水果重 32 千克，从乙筐取出 20% 后，甲乙两筐水果的重量比是 4:3。原来两筐水果共有多少千克？",
  "solution": {
    "answer": "62",
    "verified": true,
    "verificationMethod": "独立算术复核：设原乙筐为 x 千克，取出 20% 后剩 0.8x 千克；甲始终 32 千克。比例条件 32 : 0.8x = 4 : 3，交叉相乘 32×3 = 4×0.8x → 96 = 3.2x → x = 30 千克。原总重 32 + 30 = 62 千克。回代验算：乙取出 20%（即 6 千克）后剩 24 千克，32 : 24 = 4 : 3 ✓。与已验证解法一致。",
    "alternativeApproaches": [
      {
        "name": "份数法",
        "summary": "把 4:3 看作甲 4 份、乙取出后 3 份，每份 = 32÷4 = 8 kg，乙取出后 = 3×8 = 24 kg；原乙 = 24 ÷ 0.8 = 30 kg，原总 = 32+30 = 62 kg。",
        "expression": "每份 = 32 / 4 = 8 kg；乙取后 = 3 × 8 = 24 kg；原乙 = 24 / 0.8 = 30 kg；原总 = 32 + 30 = 62 kg",
        "whenToUse": "当比例两边都是整数比、且整数比容易看出「每份」时最快；尤其适合心算或口算。"
      }
    ],
    "steps": [
      {
        "id": "s1",
        "explanation": "设未知量：原乙筐为 x 千克，取出 20% 后剩 0.8x 千克；甲筐始终 32 千克（甲筐不动）。",
        "expression": "乙原 x kg；乙取后 = (1 − 20%) × x = 0.8x kg；甲 = 32 kg",
        "check": "取 20% 即乘以 0.2，剩下 1 − 0.2 = 0.8 份。"
      },
      {
        "id": "s2",
        "explanation": "把题目的 4:3 用「取出之后」的甲、乙重量表示：甲 32 千克 : 乙取出后 0.8x 千克 = 4 : 3。",
        "expression": "32 : 0.8x = 4 : 3",
        "check": "关键：4:3 是「取出后」的比，不是「取出前」的比。"
      },
      {
        "id": "s3",
        "explanation": "比值相等 → 交叉相乘（外项积等于内项积）：32 × 3 = 4 × 0.8x，得 96 = 3.2x。",
        "expression": "32 × 3 = 4 × 0.8x   ⇒   96 = 3.2x",
        "check": "比例式 a:b = c:d 等价于 a·d = b·c。"
      },
      {
        "id": "s4",
        "explanation": "解方程：x = 96 ÷ 3.2 = 30 千克。所以原乙筐有 30 千克。",
        "expression": "x = 96 / 3.2 = 30",
        "check": "30 × 0.8 = 24，回代见下一步。"
      },
      {
        "id": "s5",
        "explanation": "回代验算：乙取出 20%（6 千克）后剩 24 千克；甲乙之比 32 : 24 = 4 : 3 ✓，与题设比例一致。",
        "expression": "32 : 24 = 4 : 3   ✓",
        "check": "化简 32/24 = 4/3，两边都除以 8。"
      },
      {
        "id": "s6",
        "explanation": "原两筐水果总重 = 甲 + 原乙 = 32 + 30 = 62 千克。",
        "expression": "原总 = 32 + 30 = 62 kg",
        "check": "回代整条计算，物理/算术意义一致。"
      }
    ]
  },
  "teachingPlan": {
    "objective": "学生能识别题目中 4:3 出现在「从乙筐取出 20% 之后」而不是「取出之前」，把乙筐表示为「原 x、剩 0.8x」，代入比例式 32:0.8x=4:3 后用交叉相乘解出 x=30，最终得到原总重 62 千克。",
    "misconceptions": [
      "把 4:3 误读成「取出之前」的比，错把乙当作 x，列出 32:x = 4:3，得到 x=24（原乙筐 24 kg），但这与「取出 20% 后」矛盾。",
      "把「取出 20%」误算成「剩下 20%」，列式为 32:0.2x = 4:3，导致 x=120，原乙高达 120 千克，远超实际。",
      "把百分数当成绝对值（把 20% 当 20 kg）做差，忘记取出 20% 是按比例缩。"
    ],
    "scenes": [
      {
        "id": "orient",
        "kind": "orient",
        "title": "看清关键词：4:3 是「取出后」的比",
        "narration": "读题：甲筐 32 千克，从乙筐取出 20% 后，甲乙之比变成 4:3。这里要特别小心两个时点——取出前与取出后。比例 4:3 出现在取出之后，不是取出之前。下面把甲、乙两筐画成横向条形，乙筐原量画虚线、取出后剩的部分画实线，对照看哪两段参与 4:3 的比较。",
        "visibleMath": [
          "甲筐：始终 32 千克（不动）",
          "乙筐：原 x 千克（虚线）；取出 20% 后剩 0.8x 千克（实线）",
          "关键时点：4:3 比较的是「实线」的两段"
        ],
        "visual": {
          "focus": "区分两个时点：取出前 / 取出后",
          "bars": [
            { "label": "甲筐 32 kg（始终不变）", "value": 32, "color": "#2563eb" },
            { "label": "乙筐原 x（虚线）", "value": null, "color": "#94a3b8", "dashed": true, "label2": "x" },
            { "label": "乙筐取出后 0.8x（实线）", "value": null, "color": "#0a8f88", "label2": "0.8x" }
          ],
          "note": "4:3 描述的是：甲(取出后) vs 乙(取出后) 这两段。"
        },
        "interaction": {
          "prompt": "题目中「4:3」这个比，是哪两个量的比？",
          "options": [
            "A. 取出前：甲筐 : 乙筐原重",
            "B. 取出后：甲筐 : 乙筐剩下的",
            "C. 取出前：甲筐 : 乙筐剩下的",
            "D. 取出后：甲筐 : 乙筐原重"
          ],
          "correctIndex": 1,
          "feedback": {
            "correct": "对！题目说「从乙筐取出 20% 后」，比 4:3 出现在取出之后的两筐之间，所以是 甲取出后 : 乙取出后 = 4 : 3。",
            "incorrect": "再读题：「从乙筐取出 20% 后」才是 4:3 的时点。甲筐始终 32 千克不变；乙筐只剩 0.8x。所以 4:3 是 甲(取出后) : 乙(取出后) = 4 : 3。"
          }
        }
      },
      {
        "id": "model",
        "kind": "model",
        "title": "画条形图：甲固定 32，乙剩 0.8x",
        "narration": "把抽象的「乙取出 20%」具体画出来。甲筐始终是 32 千克的实心条，不动。乙筐分两段：原 x 千克画成虚线（被拿走的那 20% 用斜线阴影覆盖在右端），剩 0.8x 千克画成实心条。这样能看清「取出后」真正参与 4:3 比较的是谁——是实线那一段 0.8x，不是虚线那段 x。",
        "visibleMath": [
          "甲：32 kg（始终不变）",
          "乙 原 = x（虚线 + 右端 20% 阴影）",
          "乙 取出后 = 0.8x（实线，参与比较）",
          "4:3 比较的就是：甲(实线) vs 乙取后(实线)"
        ],
        "visual": {
          "focus": "乙筐虚线段 = 原 x；右端阴影 = 取出 20%",
          "bars": [
            { "label": "甲筐 32 kg", "value": 32, "color": "#2563eb" },
            { "label": "乙筐原 x（示例 x=30）", "value": 30, "color": "#94a3b8", "dashed": true },
            { "label": "乙筐取出后 = 24 kg", "value": 24, "color": "#0a8f88" }
          ],
          "xExample": 30,
          "note": "演示默认值 x=30：乙剩 24 kg，甲乙比 = 32:24 = 4:3。"
        }
      },
      {
        "id": "connect",
        "kind": "connect",
        "title": "代入比例：32 : 0.8x = 4 : 3",
        "narration": "把条形图上的实线段代入比例式：甲 32 千克 比 乙剩 0.8x 千克 = 4 : 3。这一步为什么合法？因为比例是「比值相等」的缩写——32 除以 0.8x 等于 4 除以 3，两边同乘 0.8x × 3 后得到 32 × 3 = 4 × 0.8x（外项积 = 内项积）。图中橙色虚线标在 24 处，正是 4:3 对应的「乙取后」目标位置。",
        "visibleMath": [
          "比例式：32 : 0.8x = 4 : 3",
          "等价于：32 / 0.8x = 4 / 3",
          "交叉相乘（合法，因比值相等）：32 × 3 = 4 × 0.8x",
          "化简：96 = 3.2x"
        ],
        "expression": "32 / (0.8x) = 4 / 3   \\Rightarrow   32 \\times 3 = 4 \\times 0.8x   \\Rightarrow   96 = 3.2x",
        "visual": {
          "focus": "等式两边同时乘 0.8x × 3（合法：比值相等）",
          "bars": [
            { "label": "甲筐 32 kg", "value": 32, "color": "#2563eb" },
            { "label": "乙取后 0.8x", "value": 24, "color": "#0a8f88" }
          ],
          "ratioTarget": "4 : 3",
          "xExample": 30,
          "note": "合法原因：比值相等 ⇒ 交叉相乘 ⇒ 一元一次方程。"
        }
      },
      {
        "id": "check",
        "kind": "check",
        "title": "拖滑块：找出哪个 x 让 32 : 0.8x 正好 = 4 : 3",
        "narration": "现在交给你来验证。下面的滑块控制乙筐的原重 x；右边会实时显示乙取出 20% 后剩多少、甲:乙剩 的当前比值。把滑块拖到 30 千克，看看你能不能让比值正好落在 4:3 这条橙线上。提示：甲是 32，比例 4:3 中「4 份」对应 32，所以每份 8 千克；乙剩对应 3 份，就是 24 千克；24 = 0.8x → x = 30。",
        "visibleMath": [
          "拖滑块改变 x（乙原重）",
          "实时显示：乙取后 = 0.8x",
          "实时显示：甲 : 乙取后 = ? : ?",
          "目标：把比值调到 4 : 3"
        ],
        "visual": {
          "focus": "实时联动：拖滑块 x → 自动重算 0.8x → 实时比值",
          "slider": {
            "id": "xOriginal",
            "label": "乙筐原重 x（千克）",
            "min": 10,
            "max": 60,
            "step": 1,
            "default": 24
          },
          "bars": [
            { "label": "甲筐 32 kg", "value": 32, "color": "#2563eb" },
            { "label": "乙筐原 x", "role": "yiOriginal", "value": null, "color": "#94a3b8", "dashed": true },
            { "label": "乙筐剩 0.8x", "role": "yiRemain", "value": null, "color": "#0a8f88" }
          ],
          "ratioTarget": "4 : 3",
          "feedbackHit": "找到啦！x = 30 千克时，乙剩 24 kg，32 : 24 正好等于 4 : 3 ✓"
        },
        "interaction": {
          "prompt": "哪一个 x 能让 32 : 0.8x 正好等于 4 : 3？",
          "options": [
            "A. x = 20",
            "B. x = 24",
            "C. x = 30",
            "D. x = 36"
          ],
          "correctIndex": 2,
          "feedback": {
            "correct": "对！x = 30：乙剩 0.8×30 = 24 kg；32 : 24 同除以 8 = 4 : 3 ✓。",
            "incorrect": "提示：4 : 3 中甲对应 4 份 = 32 kg，所以每份 8 kg；乙剩对应 3 份 = 24 kg；24 = 0.8x → x = 30。"
          }
        }
      },
      {
        "id": "summary",
        "kind": "summary",
        "title": "口诀与答案：原总重 62 千克",
        "narration": "回到原题：甲筐始终 32 kg，乙筐原 x kg，取出 20% 后剩 0.8x kg；由 32 : 0.8x = 4 : 3 解得 x = 30 kg。所以原来两筐水果共有 32 + 30 = 62 千克。口诀：比对时机取后剩八十，求后必验证，化简分数对应份数。",
        "visibleMath": [
          "32 + 30 = 62 kg",
          "验算：乙取 20%(6 kg) 后剩 24 kg；32 : 24 = 4 : 3 ✓",
          "答案：原来两筐水果共有 62 千克"
        ],
        "expression": "原总 = 32 + 30 = 62",
        "visual": {
          "focus": "原乙 30 + 甲 32 = 总重 62",
          "bars": [
            { "label": "甲筐 32 kg", "value": 32, "color": "#2563eb" },
            { "label": "乙筐原 30 kg", "value": 30, "color": "#94a3b8", "dashed": true },
            { "label": "乙筐取出后 24 kg", "value": 24, "color": "#0a8f88" }
          ],
          "total": 62,
          "mnemonic": "比对时机取后剩八十，求后必验证，化简分数对应份数。"
        }
      }
    ],
    "approaches": [
      {
        "id": "shares",
        "label": "份数法",
        "method": "把 4:3 想成「甲 4 份、乙取出后 3 份」，先求每份 = 32÷4 = 8 kg，再算乙取出后 = 3×8 = 24 kg，最后把 0.8 倍还原成原重 = 30 kg。",
        "whenToUse": "比例两边都是整数比时最快；适合口算/心算场景，不写方程也能直接出答案。",
        "mnemonic": "整数比是几份，先求一份量；小数比是缩放，记得还原原量。",
        "scenes": [
          {
            "id": "a-orient",
            "kind": "orient",
            "title": "换视角：把 4:3 当成「几份」",
            "narration": "主解法先把乙写成 x 再解方程。这次换个想法：4:3 这个比本身就是「4 份 vs 3 份」。把甲取出后的 32 千克想成「4 份」，那乙取出后就一定是「3 份」。",
            "visibleMath": [
              "4 : 3 = 4 份 : 3 份",
              "甲取出后 = 4 份 = 32 kg",
              "乙取出后 = 3 份 = ? kg"
            ],
            "visual": {
              "focus": "把条形按「份」划分",
              "bars": [
                { "label": "甲 = 4 份 = 32", "value": 32, "color": "#2563eb" },
                { "label": "乙取后 = 3 份 = 24", "value": 24, "color": "#0a8f88" }
              ],
              "shares": "4 份 : 3 份"
            }
          },
          {
            "id": "a-model",
            "kind": "model",
            "title": "求每份：32 ÷ 4 = 8 kg",
            "narration": "既然 4 份就是 32 千克，那每份就是 32 ÷ 4 = 8 千克。所以乙取出后是 3 份 = 3 × 8 = 24 千克。这一步不用方程，直接心算。",
            "visibleMath": [
              "每份 = 32 ÷ 4 = 8 kg",
              "乙取后 = 3 × 8 = 24 kg"
            ],
            "expression": "每份 = 32 / 4 = 8",
            "visual": {
              "focus": "每份 8 kg",
              "bars": [
                { "label": "甲 32 (4×8)", "value": 32, "color": "#2563eb" },